[
  {
    "id": "pripad-binet-simon-terman",
    "title": "Původní škála a její stanfordská revize",
    "targetEntityIds": [
      "alfred-binet",
      "theodore-simon",
      "lewis-terman"
    ],
    "targetRelationIds": [
      "alfred-binet__developed__binet-simonova-skala",
      "theodore-simon__co-authored__binet-simonova-skala",
      "lewis-terman__revised__stanford-binet"
    ],
    "goal": "Rozpoznat původní autory Binet-Simonovy škály a odlišit je od pozdější stanfordské revize.",
    "difficulty": "intermediate",
    "clues": [
      {
        "id": "c1",
        "title": "První stopa",
        "text": "Zdroj uvádí dvojici autorů jedné z nejvýznamnějších raných inteligenčních škál.",
        "unlockAfterClueIds": [],
        "focusEntityIds": [
          "alfred-binet",
          "theodore-simon"
        ],
        "weight": 1
      },
      {
        "id": "c2",
        "title": "Druhá stopa",
        "text": "Další jméno je spojeno se stanfordskou revizí této původní škály.",
        "unlockAfterClueIds": [
          "c1"
        ],
        "focusEntityIds": [
          "lewis-terman"
        ],
        "weight": 1
      },
      {
        "id": "c3",
        "title": "Přesné rozlišení",
        "text": "Nosná vazba není mezi jednotlivými jmény izolovaně, ale mezi původní škálou a její revizí.",
        "unlockAfterClueIds": [
          "c2"
        ],
        "focusEntityIds": [
          "binet-simonova-skala",
          "stanford-binet"
        ],
        "weight": 1
      }
    ],
    "questions": [
      {
        "id": "q1",
        "prompt": "Kdo vytvořil původní Binet-Simonovu škálu?",
        "answerMode": "multi-choice",
        "unlockAfterClueIds": [],
        "relatedEntityIds": [
          "alfred-binet",
          "theodore-simon",
          "lewis-terman"
        ],
        "options": [
          {
            "id": "a",
            "label": "Alfred Binet",
            "isCorrect": true,
            "rationale": "Zdroj jej uvádí jako spoluautora původní škály."
          },
          {
            "id": "b",
            "label": "Théodore Simon",
            "isCorrect": true,
            "rationale": "Zdroj jej uvádí jako spoluautora původní škály."
          },
          {
            "id": "c",
            "label": "Lewis Terman",
            "isCorrect": false,
            "rationale": "Terman vytvořil až stanfordskou revizi."
          }
        ]
      },
      {
        "id": "q2",
        "prompt": "Kdo vytvořil stanfordskou revizi původní škály?",
        "answerMode": "single-choice",
        "unlockAfterClueIds": [
          "c2"
        ],
        "relatedEntityIds": [
          "lewis-terman"
        ],
        "options": [
          {
            "id": "a",
            "label": "Lewis Terman",
            "isCorrect": true,
            "rationale": "Zdroj jej výslovně spojuje se Stanford-Binet."
          },
          {
            "id": "b",
            "label": "Alfred Binet",
            "isCorrect": false,
            "rationale": "Binet patří k původní škále."
          },
          {
            "id": "c",
            "label": "Théodore Simon",
            "isCorrect": false,
            "rationale": "Simon patří k původní škále."
          }
        ]
      }
    ],
    "evaluation": {
      "minimumCorrectQuestions": 2,
      "allowHintRecovery": true
    },
    "followUpExplanation": "Zdroj vede Bineta a Simona jako autory původní škály a Termanovo jméno spojuje se stanfordskou revizí. Přesně tato síťová návaznost je pro studium zásadní.",
    "sourceReferences": [
      {
        "sourceDocumentId": "mini-wikipedie-osobnosti-vs",
        "locator": "Lewis Terman",
        "excerpt": "Vytvořil stanfordskou revizi původní Binet-Simonovy škály."
      }
    ]
  },
  {
    "id": "pripad-braille-a-predchudci",
    "title": "Který systém se stal standardem",
    "targetEntityIds": [
      "josef-julius-barbier",
      "louis-braille",
      "william-moon"
    ],
    "targetRelationIds": [
      "josef-julius-barbier__associated-with__bodove-nocni-pismo",
      "josef-julius-barbier__inspired__louis-braille",
      "louis-braille__associated-with__braillovo-pismo"
    ],
    "goal": "Odlišit předstupeň Braillova písma od standardní bodové soustavy a od alternativního Moonova systému.",
    "difficulty": "intermediate",
    "clues": [
      {
        "id": "c1",
        "title": "Předstupeň",
        "text": "Jedno jméno je ve zdroji spojeno s bodovým nočním písmem, z něhož později Louis Braille vyšel.",
        "unlockAfterClueIds": [],
        "focusEntityIds": [
          "josef-julius-barbier",
          "bodove-nocni-pismo"
        ],
        "weight": 1
      },
      {
        "id": "c2",
        "title": "Standard",
        "text": "Druhé jméno je spojeno se světovým standardem čtení a psaní pro nevidomé.",
        "unlockAfterClueIds": [
          "c1"
        ],
        "focusEntityIds": [
          "louis-braille",
          "braillovo-pismo"
        ],
        "weight": 1
      },
      {
        "id": "c3",
        "title": "Alternativa",
        "text": "Třetí jméno představuje důležitou alternativu k Braillovu písmu.",
        "unlockAfterClueIds": [
          "c2"
        ],
        "focusEntityIds": [
          "william-moon",
          "moonovo-reliefni-pismo"
        ],
        "weight": 1
      }
    ],
    "questions": [
      {
        "id": "q1",
        "prompt": "Kdo vytvořil systém, z něhož Louis Braille vyšel?",
        "answerMode": "single-choice",
        "unlockAfterClueIds": [],
        "relatedEntityIds": [
          "josef-julius-barbier",
          "louis-braille",
          "william-moon"
        ],
        "options": [
          {
            "id": "a",
            "label": "Josef Julius Barbier",
            "isCorrect": true,
            "rationale": "Zdroj jej uvádí jako autora bodového nočního písma."
          },
          {
            "id": "b",
            "label": "Louis Braille",
            "isCorrect": false,
            "rationale": "Braille vytvořil až vlastní soustavu."
          },
          {
            "id": "c",
            "label": "William Moon",
            "isCorrect": false,
            "rationale": "Moon představuje alternativní reliéfní písmo."
          }
        ]
      },
      {
        "id": "q2",
        "prompt": "Který systém se ve zdroji stal světovým standardem?",
        "answerMode": "single-choice",
        "unlockAfterClueIds": [
          "c2"
        ],
        "relatedEntityIds": [
          "braillovo-pismo",
          "moonovo-reliefni-pismo"
        ],
        "options": [
          {
            "id": "a",
            "label": "Braillovo písmo",
            "isCorrect": true,
            "rationale": "Zdroj výslovně mluví o světovém standardu."
          },
          {
            "id": "b",
            "label": "Moonovo reliéfní písmo",
            "isCorrect": false,
            "rationale": "Zdroj je uvádí jako alternativu."
          }
        ]
      }
    ],
    "evaluation": {
      "minimumCorrectQuestions": 2,
      "allowHintRecovery": true
    },
    "followUpExplanation": "Nosná vazba vede od Barbierova nočního písma k Braillově šestibodové soustavě. Moonův systém je ve zdroji zachycen jako alternativa, nikoli jako standard.",
    "sourceReferences": [
      {
        "sourceDocumentId": "mini-wikipedie-osobnosti-vs",
        "locator": "Louis Braille",
        "excerpt": "Braillovo písmo se stalo světovým standardem."
      }
    ]
  },
  {
    "id": "pripad-broca-wernicke",
    "title": "Dvě afatické stopy",
    "targetEntityIds": [
      "paul-broca",
      "carl-wernicke"
    ],
    "targetRelationIds": [
      "paul-broca__contrasts-with__carl-wernicke"
    ],
    "goal": "Rozlišit neurologické základy motorické a senzorické afázie.",
    "difficulty": "introductory",
    "clues": [
      {
        "id": "c1",
        "title": "Motorická linie",
        "text": "Jedno jméno musí mít student pevně spojeno s motorickou složkou řeči.",
        "unlockAfterClueIds": [],
        "focusEntityIds": [
          "paul-broca",
          "brocova-oblast",
          "motoricka-afazie"
        ],
        "weight": 1
      },
      {
        "id": "c2",
        "title": "Porozumění řeči",
        "text": "Druhé jméno patří k porozumění řeči a senzorické afázii.",
        "unlockAfterClueIds": [
          "c1"
        ],
        "focusEntityIds": [
          "carl-wernicke",
          "wernickeova-oblast",
          "senzoricka-afazie"
        ],
        "weight": 1
      }
    ],
    "questions": [
      {
        "id": "q1",
        "prompt": "Které jméno patří k motorické afázii?",
        "answerMode": "single-choice",
        "unlockAfterClueIds": [],
        "relatedEntityIds": [
          "paul-broca",
          "carl-wernicke"
        ],
        "options": [
          {
            "id": "a",
            "label": "Paul Broca",
            "isCorrect": true,
            "rationale": "Zdroj to uvádí výslovně."
          },
          {
            "id": "b",
            "label": "Carl Wernicke",
            "isCorrect": false,
            "rationale": "Wernicke patří k porozumění řeči a senzorické afázii."
          }
        ]
      },
      {
        "id": "q2",
        "prompt": "Které jméno patří k porozumění řeči?",
        "answerMode": "single-choice",
        "unlockAfterClueIds": [
          "c2"
        ],
        "relatedEntityIds": [
          "paul-broca",
          "carl-wernicke"
        ],
        "options": [
          {
            "id": "a",
            "label": "Carl Wernicke",
            "isCorrect": true,
            "rationale": "Zdroj uvádí senzorickou afázii a porozumění řeči."
          },
          {
            "id": "b",
            "label": "Paul Broca",
            "isCorrect": false,
            "rationale": "Broca patří k motorické složce řeči."
          }
        ]
      }
    ],
    "evaluation": {
      "minimumCorrectQuestions": 2,